{
  "id": "cursor",
  "kind": "ide-hint",
  "hint": "Sem CLI de despacho. No Cursor use Task com model=\"<slug>\" obrigatorio; obtenha o slug com: orchestrator route --task-class <classe> --client cursor --json",
  "notes": "Task sem model= herda o modelo do pai (bug de uso conhecido). Slugs em config/models.json clients.cursor.models."
}
